database,title,url,year,num_citations,num_versions,cluster_id,url_pdf,url_citations,url_versions,url_citation,excerpt,
Google Scholar,An Interactive Multisensing Framework for Personalized Human Robot Collaboration and Assistive Training Using Reinforcement Learning,http://scholar.google.com/https://dl.acm.org/citation.cfm?id=3076191,2017,0,0,None,None,None,None,None,"There is a recent trend of research and applications of Cyber-Physical Systems (CPS) in manufacturing to enhance human-robot collaboration and production. In this paper, we propose a CPS framework for personalized Human-Robot Collaboration and Training to …",
Google Scholar,Representation and Reinforcement Learning for Personalized Glycemic Control in Septic Patients,http://scholar.google.com/https://arxiv.org/abs/1712.00654,2017,0,3,None,None,None,"http://scholar.google.com/scholar?cluster=3499500435873679663&hl=en&as_sdt=0,5",None,"Glycemic control is essential for critical care. However, it is a challenging task because there has been no study on personalized optimal strategies for glycemic control. This work aims to learn personalized optimal glycemic trajectories for severely ill septic patients by learning …",
Google Scholar,… CoreAcquisition and Maintenance of Knowledge for Online Navigation SuggestionsCHQ: A Multi-Agent Reinforcement Learning Scheme for Partially …,http://scholar.google.com/https://search.ieice.org/bin/index.php?category=D&lang=E;&num=5&vol=E88-D&year=2005,None,0,2,None,None,None,"http://scholar.google.com/scholar?cluster=4109290038346175065&hl=en&as_sdt=0,5",None,Archive. Japanese Page. SITE TOP. Login. Site License A B C D >. Forgotten your password?Menu. Search: Full-Text Search; Search(JPN). Latest Issue. A Fundamentals:Trans.Fundamentals. JPN Edition(in Japanese). B Communications: Trans.Commun. JPN …,
Google Scholar,… Intelligent Framework for Personalized Simulation-enhanced Surgery Assistance: Linking a Simulation Ontology to a Reinforcement Learning Algorithm for Calibration …,http://scholar.google.com/https://journals.ub.uni-heidelberg.de/index.php/emcl-pp/article/view/42079,2017,1,0,5.62460122550578E+018,None,"http://scholar.google.com/scholar?cites=5624601225505777501&as_sdt=2005&sciodt=0,5&hl=en",None,None,"Evolving our previous research results in the context of cognition-guidance and patient-specifity for simulation-enhanced cardiac surgery assistance, in this work we further investigate on (1) a machine learning framework which allows to patient-individually …",
Google Scholar,PERSONALIZED INSULIN INFUSION IN TYPE 1 DIABETES BASED ON REINFORCEMENT LEARNING,None,2014,0,0,None,None,None,None,None,None,
Google Scholar,"… of the Book Statistical Methods for Dynamic Treatment Regimes: Reinforcement Learning, Causal Inference, and Personalized Medicine by Bibhas …",http://scholar.google.com/https://www.infona.pl/resource/bwmeta1.element.springer-doi-10_1007-S13253-015-0204-7,2015,0,2,None,None,None,"http://scholar.google.com/scholar?cluster=949719320383321427&hl=en&as_sdt=0,5",None,None,
Google Scholar,Personalised Human-Robot Co-Adaptation in Instructional Settings using Reinforcement Learning,http://www.diva-portal.org/smash/get/diva2:1162389/FULLTEXT01.pdf,2017,1,3,1.42095071540383E+019,http://www.diva-portal.org/smash/get/diva2:1162389/FULLTEXT01.pdf,"http://scholar.google.com/scholar?cites=14209507154038331625&as_sdt=2005&sciodt=0,5&hl=en","http://scholar.google.com/scholar?cluster=14209507154038331625&hl=en&as_sdt=0,5",None,"In the domain of robotic tutors, personalised tutoring has started to receive scientists' attention, but is still relatively underexplored. Previous work using reinforcement learning (RL) has addressed personalised tutoring from the perspective of affective policy learning. In …",
Google Scholar,Personalized Attention-Aware Exposure Control Using Reinforcement Learning,http://scholar.google.com/https://arxiv.org/abs/1803.02269,2018,0,2,None,None,None,"http://scholar.google.com/scholar?cluster=16088264069985027389&hl=en&as_sdt=0,5",None,"We propose a reinforcement learning approach for real-time exposure control of a mobile camera that is personalizable. Our approach is based on Markov Decision Process (MDP). In the camera viewfinder or live preview mode, given the current frame, our system predicts …",
Google Scholar,Applying reinforcement and mastery learning: how it works based on personalized e-learning curriculum?,http://scholar.google.com/https://su-plus.strathmore.edu/handle/11071/3967,2014,0,5,None,None,None,"http://scholar.google.com/scholar?cluster=2431405743841653352&hl=en&as_sdt=0,5",None,"… In this paper, the system is able to perform reinforcement learning and mastery … the curriculumcontinuity of successive curriculum while implementing personalized learning sequence … Althoughthe paper has successfully implemented personalization, reinforcement and mastery … ",
Google Scholar,Personalized Anticoagulant Management Using Reinforcement Learning,http://search.proquest.com/openview/0fb11186b745ecde7d14d2839d94f6aa/1?pq-origsite=gscholar&cbl=18750&diss=y,2014,0,3,None,None,None,"http://scholar.google.com/scholar?cluster=3695353546665257597&hl=en&as_sdt=0,5",None,Introduction: There are many problems with current state-of-the-art protocols for maintenance dosing of the oral anticoagulant agent warfarin used in clinical practice. The two key challenges include lack of personalized dose adjustment and the high cost of …,
Google Scholar,Personal Style Learning in Sumi-e Stroke-based Rendering by Inverse Reinforcement Learning,http://scholar.google.com/https://ipsj.ixsq.nii.ac.jp/ej/index.php?action=pages_view_main&active_action=repository_action_common_download&item_id=96198&item_no=1&attribute_id=1&file_no=1&page_id=13&block_id=8,2013,0,4,None,None,None,"http://scholar.google.com/scholar?cluster=14849358291521081083&hl=en&as_sdt=0,5",None,"We consider the problem of automatically generating sumi-e style drawings using machine learning techniques. In our previous work, we regarded a brush as a computer agent and trained the brush to generate smooth strokes to fill given boundaries under a pre-designed …",
Google Scholar,Reinforcement machine learning for personalized intelligent alerting,http://scholar.google.com/https://patents.google.com/patent/US20170083929A1/en,2017,0,2,None,None,None,"http://scholar.google.com/scholar?cluster=8387125370688857537&hl=en&as_sdt=0,5",None,"… to an automated process that employs machine learning to create individually tailored alerts and …Based on the learning and results of the personalized game, suggested alerts are provided tothe … being executed by a computer or other machine, such as a personal data assistant … ",
