"Introduce the ""Flipped Classroom"" into the Basic Medical Experimental Teaching by the Medical Virtual Simulation Platform",G. Zhenying; B. Huiling; W. Guoying,"Sch. of Med., Henan Univ., Kaifeng, China",2015 7th International Conference on Information Technology in Medicine and Education (ITME),20160310,2015,,,484,487,"Based on drawing ""flipped classroom"" experience of practitioners domestic and foreign, together with the full use of modern information tools and the reinforcement of the construction of discipline support system, we build the medical virtual simulation platform. On this basis, we perform reasonable instructional design and good application of ""flipped classroom"" in medical experimental teaching. These efforts adapt the learning requirements of students at different levels, and can enhance students' self-learning ability. These efforts can also train students' creative and independent thinking ability, achieve personalized learning, and improve the quality of medical students' experimental teaching. Construction of medical virtual simulation platform in the school of medicine not only provides a new method for basic medical experimental teaching to enable introduction of ""flipped classroom"" into basic medical experimental teaching, but also promotes implementation of information education and improves the teaching quality of professional disciplines.",,CD-ROM:978-1-4673-8301-1; Electronic:978-1-4673-8302-8; POD:978-1-4673-8303-5,10.1109/ITME.2015.172,,https://ieeexplore.ieee.org/stamp/stamp.jsp?arnumber=7429195,"""flipped classroom"";basic medicine;experimental teaching",Adaptation models;Computational modeling;Computers;Education;Online services;Solid modeling;Videos,computer aided instruction;educational institutions;human factors;learning (artificial intelligence);medical computing;teaching,"""Flipped Classroom"";information education;medical experimental teaching;medical virtual simulation platform;modern information tool",,,,9,,,,13-15 Nov. 2015,,IEEE,IEEE Conferences
Work in progress — Tools and technology to implement a students personal laboratory,M. Walters,"Academic Product Manager, National Instruments",2011 Frontiers in Education Conference (FIE),20120202,2011,,,F1G-1,F1G-2,"Today's students want to solve problems and experience engineering regardless of where they are - in lecture, in the laboratory, or the dorm room. Professors want to provide a hands-on learning experience to empower students who want to tinker, experiment, and explore concepts while improving the comprehension through reinforcement. Student access to affordable, low-cost technology enables educators to address limitations in the laboratory, including access to equipment, time on task, and cost. With a portable laboratory, a student can learn concepts in their preferred environments and provides a supplement to the traditional lecture and laboratory based courses.",0190-5848;01905848,Electronic:978-1-61284-469-5; POD:978-1-61284-468-8; USB:978-1-61284-467-1,10.1109/FIE.2011.6143112,,https://ieeexplore.ieee.org/stamp/stamp.jsp?arnumber=6143112,hands-on;myDAQ;student-laboratory;student-ownership,Data acquisition;Educational institutions;Hardware;Instruments;Laboratories;Nickel;Signal generators,data acquisition;educational technology;engineering education;laboratory techniques;portable instruments;virtual instrumentation,equipment access;hands-on learning experience;low-cost educational technology;myDAQ;portable laboratory;students personal laboratory;work in progress,,1,,3,,,,12-15 Oct. 2011,,IEEE,IEEE Conferences
Implications of decentralized Q-learning resource allocation in wireless networks,F. Wilhelmi; B. Bellalta; C. Cano; A. Jonsson,"Wireless Networking (WN-UPF), Universitat Pompeu Fabra, Barcelona, Spain","2017 IEEE 28th Annual International Symposium on Personal, Indoor, and Mobile Radio Communications (PIMRC)",20180215,2017,,,1,5,"Reinforcement Learning is gaining attention by the wireless networking community due to its potential to learn good-performing configurations only from the observed results. In this work we propose a stateless variation of Q-learning, which we apply to exploit spatial reuse in a wireless network. In particular, we allow networks to modify both their transmission power and the channel used solely based on the experienced throughput. We concentrate in a completely decentralized scenario in which no information about neighbouring nodes is available to the learners. Our results show that although the algorithm is able to find the best-performing actions to enhance aggregate throughput, there is high variability in the throughput experienced by the individual networks. We identify the cause of this variability as the adversarial setting of our setup, in which the most played actions provide intermittent good/poor performance depending on the neighbouring decisions. We also evaluate the effect of the intrinsic learning parameters of the algorithm on this variability.",,Electronic:978-1-5386-3531-5; POD:978-1-5386-3532-2; Paper:978-1-5386-3529-2; USB:978-1-5386-3530-8,10.1109/PIMRC.2017.8292321,,https://ieeexplore.ieee.org/stamp/stamp.jsp?arnumber=8292321,,Aggregates;Interference;Meters;Resource management;Signal to noise ratio;Throughput;Wireless networks,learning (artificial intelligence);radio networks;resource allocation,Reinforcement Learning;decentralized Q-learning resource allocation;wireless network;wireless networking community,,,,,,,,8-13 Oct. 2017,,IEEE,IEEE Conferences
Dynamic power control in Wireless Body Area Networks using reinforcement learning with approximation,R. Kazemi; R. Vesilo; E. Dutkiewicz; Ren Liu,"Department of Electronic Engineering, Macquarie University, Sydney, Australia","2011 IEEE 22nd International Symposium on Personal, Indoor and Mobile Radio Communications",20120126,2011,,,2203,2208,"A Wireless Body Area Network (WBAN) is made up of multiple tiny physiological sensors implanted in/on the human body with each sensor equipped with a wireless transceiver that communicates to a coordinator in a star topology. Energy is the scarcest resource in WBANs. Power control mechanisms to achieve a certain level of utility while using as little power for transmission as possible can play an important role in reducing energy consumption in such very energy-constrained networks. In this paper, we propose a novel power controller to mitigate internetwork interference in WBANs and increase the maximum achievable throughput with the minimum energy consumption. The proposed power controller employs reinforcement learning with approximation to learn from the environment and improve its performance. We compare the performance of the proposed controller to two other power controllers, one based on game theory and the other one based on fuzzy logic. Simulation results show that compared to the other two approaches, RLPC provides a substantial saving in energy consumption per bit, with a substantial increase in network lifetime.",2166-9570;21669570,Electronic:978-1-4577-1348-4; POD:978-1-4577-1346-0; USB:978-1-4577-1347-7,10.1109/PIMRC.2011.6139908,,https://ieeexplore.ieee.org/stamp/stamp.jsp?arnumber=6139908,Dynamic Power Control;Fuzzy Logic;Game Theory;Interference;Reinforcement Learning;WBAN,Approximation methods;Energy consumption;Interference;Power control;Sensors;Throughput;Wireless sensor networks,approximation theory;body area networks;control engineering computing;fuzzy control;game theory;interference suppression;learning (artificial intelligence);power control;radio transceivers;telecommunication control;telecommunication network reliability,WBAN;approximation;dynamic power control;energy consumption reduction;energy-constrained networks;fuzzy logic;game theory;interference mitigation;network lifetime;physiological sensors;reinforcement learning;wireless body area networks;wireless transceiver,,6,,17,,,,11-14 Sept. 2011,,IEEE,IEEE Conferences
User centered and context dependent personalization through experiential transcoding,S. Ferretti; S. Mirri; C. Prandi; P. Salomoni,"Department of Computer Science and Engineering University of Bologna Bologna, Italy",2014 IEEE 11th Consumer Communications and Networking Conference (CCNC),20141103,2014,,,486,491,"The pervasive presence of devices exploited to use and deliver entertainment text-based content can make reading easier to get but more difficult to enjoy, in particular for people with reading-related disabilities. The main solutions that allow overcoming some of the difficulties experienced by users with specific and special needs are based on content adaptation and user profiling. This paper presents a system that aims to improve content legibility by exploiting experiential transcoding techniques. The system we propose tracks users' behaviors so as to provide a tailored adaptation of textual content, in order to fit the needs of a specific user on the several different devices she/he actually uses.",2331-9852;23319852,Electronic:978-1-4799-2355-7; POD:978-1-4799-2357-1,10.1109/CCNC.2014.6940520,,https://ieeexplore.ieee.org/stamp/stamp.jsp?arnumber=6940520,content adaptation;device capabilities;legibility;reinforcement learning;user profiling,Adaptation models;Context;Entertainment industry;Multimedia communication;Prototypes;Transcoding;Web pages,Web sites;assisted living;human factors;text analysis;transcoding;ubiquitous computing,content adaptation;content legibility improvement;context dependent personalization;entertainment text-based content;transcoding techniques;user centered personalization;user profiling,,4,,23,,,,10-13 Jan. 2014,,IEEE,IEEE Conferences
Concept maps and learning objects,L. I. Navarro; M. M. Such; D. M. Martin; C. P. Sancho; P. P. Peco,"Dept. of Comput. Sci., Agrarian Univ. of Havana, Cuba",Fifth IEEE International Conference on Advanced Learning Technologies (ICALT'05),20050919,2005,,,263,265,"Concept maps constitute one of the tools frequently used in learning management as they offer the possibility to personalize learning, share knowledge and reinforce learning to learn skills. At the same time, many initiatives or standards are being developed rapidly to make the contents in different learning management systems and learning environments compatible. This paper states the need to combine the technique of Concept Maps with initiatives that package contents developed by IMS to produce more portable and powerful content. A model to create tools for learning management is proposed.",2161-3761;21613761,POD:0-7695-2338-2,10.1109/ICALT.2005.90,,https://ieeexplore.ieee.org/stamp/stamp.jsp?arnumber=1508670,,Computer science;Content management;Education;Environmental management;Knowledge management;Packaging;Power system management;Power system modeling;Psychology;Standards development,computer aided instruction;educational administrative data processing,concept maps;knowledge sharing;learning environments;learning management systems;learning objects;learning personalization;learning reinforcement;skills learning,,1,,8,,,,5-8 July 2005,,IEEE,IEEE Conferences
GongBroker: A Broker Model for Power Trading in Smart Grid Markets,X. Wang; M. Zhang; F. Ren; T. Ito,"Sch. of Comput. & Inf. Technol., Univ. of Wollongong, Wollongong, NSW, Australia",2015 IEEE/WIC/ACM International Conference on Web Intelligence and Intelligent Agent Technology (WI-IAT),20160204,2015,2,,21,24,"The Smart Grid market is dynamic and complex, and brokers are widely introduced to better manage this market. This paper proposes an intelligent broker model - GongBroker, with smart trading strategies to cope with the dynamics and complexity. GongBroker first predicts the short-term demands of various consumers, and then buys energy from the wholesale market through auctions, and sells energy to various consumers in the retail market. In order to predict the customer demand, a data-driven method is proposed. All the consumers are hierarchically clustered according to their historical energy consumptions, and different prediction methods are tailored for different customer clusters to predict one-day-ahead hourly energy demand. Based on the predicted demand, the GongBroker employs a Markov Decision Process for the one-day-ahead auction in the wholesale market. To compete with other brokers, GongBroker uses independent reinforcement learning processes to optimize prices for different types of consumers. Experimental results demonstrate that GongBroker not only is competitive in making profit, but also keeps a good supply-demand balance.",,Electronic:978-1-4673-9618-9; POD:978-1-4673-9619-6,10.1109/WI-IAT.2015.108,,https://ieeexplore.ieee.org/stamp/stamp.jsp?arnumber=7397309,Broker Model;Data-driven;Reinforcement Learning;Smart Grid Market,Adaptation models;Electronic mail;Energy consumption;Mathematical model;Prediction algorithms;Prediction methods;Smart grids,Markov processes;demand side management;learning (artificial intelligence);power markets;smart power grids;supply and demand,GongBroker;Markov decision process;consumers short-term demands;data-driven method;day-ahead hourly energy demand;independent reinforcement learning processes;intelligent broker model;power trading;prediction methods;smart grid markets;smart trading strategies;supply-demand balance,,1,,6,,,,6-9 Dec. 2015,,IEEE,IEEE Conferences
Attention-Aware Face Hallucination via Deep Reinforcement Learning,Q. Cao; L. Lin; Y. Shi; X. Liang; G. Li,"Sch. of Data & Comput. Sci., Sun Yat-sen Univ., Guangzhou, China",2017 IEEE Conference on Computer Vision and Pattern Recognition (CVPR),20171109,2017,,,1656,1664,"Face hallucination is a domain-specific super-resolution problem with the goal to generate high-resolution (HR) faces from low-resolution (LR) input images. In contrast to existing methods that often learn a single patch-to-patch mapping from LR to HR images and are regardless of the contextual interdependency between patches, we propose a novel Attention-aware Face Hallucination (Attention-FH) framework which resorts to deep reinforcement learning for sequentially discovering attended patches and then performing the facial part enhancement by fully exploiting the global interdependency of the image. Specifically, in each time step, the recurrent policy network is proposed to dynamically specify a new attended region by incorporating what happened in the past. The state (i.e., face hallucination result for the whole image) can thus be exploited and updated by the local enhancement network on the selected region. The Attention-FH approach jointly learns the recurrent policy network and local enhancement network through maximizing the long-term reward that reflects the hallucination performance over the whole image. Therefore, our proposed Attention-FH is capable of adaptively personalizing an optimal searching path for each face image according to its own characteristic. Extensive experiments show our approach significantly surpasses the state-of-the-arts on in-the-wild faces with large pose and illumination variations. The state (i.e., face hallucination result for the whole image) can thus be exploited and updated by the local enhancement network on the selected region. The Attention-FH approach jointly learns the recurrent policy network and local enhancement network through maximizing the long-term reward that reflects the hallucination performance over the whole image. Therefore, our proposed Attention-FH is capable of adaptively personalizing an optimal searching path for each face image according to its own characteristic. Extensive experiments show our appro- ch significantly surpasses the state-of-the-arts on in-the-wild faces with large pose and illumination variations.",1063-6919;10636919,Electronic:978-1-5386-0457-1; POD:978-1-5386-0458-8,10.1109/CVPR.2017.180,,https://ieeexplore.ieee.org/stamp/stamp.jsp?arnumber=8099663,,Computer vision;Face;History;Image resolution;Learning (artificial intelligence);Neural networks,face recognition;image enhancement;image resolution;learning (artificial intelligence),attention-FH approach;attention-aware face hallucination;deep reinforcement learning;domain-specific super-resolution problem;facial part enhancement;hallucination performance;high-resolution face generation;in-the-wild faces;local enhancement network;low-resolution input images;optimal searching path;patch-to-patch mapping;recurrent policy network,,1,,,,,,21-26 July 2017,,IEEE,IEEE Conferences
Data-driven inverse learning of passenger preferences in urban public transits,G. Wu; Y. Ding; Y. Li; J. Luo; F. Zhang; J. Fu,"Worcester Polytechnic Institute (WPI), 100 Institute Road, Worcester, MA 01609, USA",2017 IEEE 56th Annual Conference on Decision and Control (CDC),20180122,2017,,,5068,5073,"Urban public transit planning is crucial in reducing traffic congestion and enabling green transportation. However, there is no systematic way to integrate passengers' personal preferences in planning public transit routes and schedules so as to achieve high occupancy rates and efficiency gain of ride-sharing. In this paper, we take the first step tp exact passengers' preferences in planning from history public transit data. We propose a data-driven method to construct a Markov decision process model that characterizes the process of passengers making sequential public transit choices, in bus routes, subway lines, and transfer stops/stations. Using the model, we integrate softmax policy iteration into maximum entropy inverse reinforcement learning to infer the passenger's reward function from observed trajectory data. The inferred reward function will enable an urban planner to predict passengers' route planning decisions given some proposed transit plans, for example, opening a new bus route or subway line. Finally, we demonstrate the correctness and accuracy of our modeling and inference methods in a large-scale (three months) passenger-level public transit trajectory data from Shenzhen, China. Our method contributes to smart transportation design and human-centric urban planning.",,Electronic:978-1-5090-2873-3; POD:978-1-5090-2874-0; USB:978-1-5090-2872-6,10.1109/CDC.2017.8264410,,https://ieeexplore.ieee.org/stamp/stamp.jsp?arnumber=8264410,,Data models;Entropy;Markov processes;Planning;Public transportation;Roads;Trajectory,Markov processes;data analysis;entropy;learning (artificial intelligence);town and country planning;traffic engineering computing;transportation,China;Markov decision process model;Shenzhen;bus route;bus routes;data-driven inverse learning;data-driven method;enabling green transportation;green transportation;high occupancy rates;history public transit data;human-centric urban planning;inference methods;inferred reward function;large-scale passenger-level public transit trajectory data;maximum entropy inverse reinforcement;observed trajectory data;public transit routes;sequential public transit choices;smart transportation design;traffic congestion;transit plans;urban planner;urban public transit planning,,,,,,,,12-15 Dec. 2017,,IEEE,IEEE Conferences
Personalized Course Sequence Recommendations,J. Xu; T. Xing; M. van der Schaar,"Department of Electrical and Computer Engineering, University of Miami, Coral Gables, FL, USA",IEEE Transactions on Signal Processing,20160824,2016,64,20,5340,5352,"Given the variability in student learning, it is becoming increasingly important to tailor courses as well as course sequences to student needs. This paper presents a systematic methodology for offering personalized course sequence recommendations to students. First, a forward-search backward-induction algorithm is developed that can optimally select course sequences to decrease the time required for a student to graduate. The algorithm accounts for prerequisite requirements (typically present in higher level education) and course availability. Second, using the tools of multiarmed bandits, an algorithm is developed that can optimally recommend a course sequence that both reduces the time to graduate while also increasing the overall GPA of the student. The algorithm dynamically learns how students with different contextual backgrounds perform for given course sequences and, then, recommends an optimal course sequence for new students. Using real-world student data from the UCLA Mechanical and Aerospace Engineering Department, we illustrate how the proposed algorithms outperform other methods that do not include student contextual information when making course sequence recommendations.",1053-587X;1053587X,,10.1109/TSP.2016.2595495,10.13039/100000001 - National Science Foundation; ,https://ieeexplore.ieee.org/stamp/stamp.jsp?arnumber=7524023,Personalized education;contextual bandits;course sequence recommendation;dynamic programming,Adaptive systems;Aerospace engineering;Complexity theory;Education;Electronic mail;Heuristic algorithms;Signal processing algorithms,aerospace computing;computer aided instruction;educational courses;engineering education;inference mechanisms;mechanical engineering computing;recommender systems,GPA;UCLA Mechanical and Aerospace Engineering Department;contextual backgrounds;course availability;forward-search backward-induction algorithm;multiarmed bandit tool;personalized course sequence recommendations;prerequisite requirements;student learning;systematic methodology,,2,,,,,20160727,"Oct.15, 15 2016",,IEEE,IEEE Journals & Magazines
Policy search for learning robot control using sparse data,B. Bischoff; D. Nguyen-Tuong; H. van Hoof; A. McHutchon; C. E. Rasmussen; A. Knoll; J. Peters; M. P. Deisenroth,"Cognitive Systems, Bosch Corporate Research, Germany",2014 IEEE International Conference on Robotics and Automation (ICRA),20140929,2014,,,3882,3887,"In many complex robot applications, such as grasping and manipulation, it is difficult to program desired task solutions beforehand, as robots are within an uncertain and dynamic environment. In such cases, learning tasks from experience can be a useful alternative. To obtain a sound learning and generalization performance, machine learning, especially, reinforcement learning, usually requires sufficient data. However, in cases where only little data is available for learning, due to system constraints and practical issues, reinforcement learning can act suboptimally. In this paper, we investigate how model-based reinforcement learning, in particular the probabilistic inference for learning control method (Pilco), can be tailored to cope with the case of sparse data to speed up learning. The basic idea is to include further prior knowledge into the learning process. As Pilco is built on the probabilistic Gaussian processes framework, additional system knowledge can be incorporated by defining appropriate prior distributions, e.g. a linear mean Gaussian prior. The resulting Pilco formulation remains in closed form and analytically tractable. The proposed approach is evaluated in simulation as well as on a physical robot, the Festo Robotino XT. For the robot evaluation, we employ the approach for learning an object pick-up task. The results show that by including prior knowledge, policy learning can be sped up in presence of sparse data.",1050-4729;10504729,Electronic:978-1-4799-3685-4; POD:978-1-4799-3686-1; USB:978-1-4799-3684-7,10.1109/ICRA.2014.6907422,,https://ieeexplore.ieee.org/stamp/stamp.jsp?arnumber=6907422,,Computational modeling;Data models;Grasping;Heuristic algorithms;Pneumatic systems;Robots;Valves,Gaussian distribution;Gaussian processes;learning (artificial intelligence);learning systems;probability;robots,Festo Robotino XT;PILCO;dynamic environment;generalization performance;grasping;learning robot control;linear mean Gaussian prior distribution;machine learning;manipulation;model-based reinforcement learning;object pick-up task;physical robot;policy learning;policy search;probabilistic Gaussian processes framework;probabilistic inference for learning control method;sound learning;sparse data;system constraints;uncertain environment,,3,,14,,,,May 31 2014-June 7 2014,,IEEE,IEEE Conferences
