Impedance Control of Robot Manipulator in Contact Task Using Machine Learning,B. Kim; S. Park,"Department of Mechanical Engineering, Korea University, Seoul, Korea, Tel : +82-2-3290-3868; E-mail: biomimetic@korea.ac.kr",2006 SICE-ICASE International Joint Conference,20070226,2006,,,2590,2594,"In performing contact tasks using robot manipulators, force control is essential. One approach is to select appropriate stiffness ellipse at the endpoint of the manipulator, where stiffness ellipse is a geometrical shape of force element represented in the principal axis of task space. In this study, we introduce a novel method to tailor stiffness ellipse required to perform contact tasks by using associative search network. Using appropriate performance indexes in the open-door task experiment, we acquired stiffness ellipse trajectory which optimizes dynamic movement of manipulator. Derived stiffness ellipse (or impedance in general) through learning process can be used for the similar task of learning process",,CD-ROM:89-950038-5-5; POD:89-950038-4-7,10.1109/SICE.2006.314795,,https://ieeexplore.ieee.org/stamp/stamp.jsp?arnumber=4108082,Associative Search Network;Contact task;impedance control;reinforcement learning;stiffness ellipse,Force control;Humans;Impedance;Machine learning;Manipulators;Mechanical engineering;Orbital robotics;Performance analysis;Robot control;Shape,force control;learning (artificial intelligence);manipulators,associative search network;force control;impedance control;machine learning;robot manipulator;stiffness ellipse,,2,,14,,,,18-21 Oct. 2006,,IEEE,IEEE Conferences
Implementation of a learning fuzzy controller,S. Shenoi; K. Ashenayi; M. Timmerman,"Center for Intelligent Syst., Tulsa Univ., OK, USA",IEEE Control Systems,20020806,1995,15,3,73,80,"This article describes our efforts at designing and implementing a practical learning fuzzy controller using inexpensive hardware. The controller engages basic control concepts and system-independent learning rules to enable it to adapt in real time to unknown plants even when it starts with a vacuous initial control policy. The controller remains dormant when the plant is operating satisfactorily and autonomously initiates online adaptation in real time when adverse performance is observed. The Intel-8031-based hardware implementation is geared for extensibility, robustness, and fault tolerance. Limited plant-dependent information is incorporated to tailor the hardware to applications. The design produces learning rates exceeding 200 reinforcements per second. The controller thus is able to learn to control unknown plants in real time even while it is controlling them. Physical experiments indicate that the learning fuzzy controller can rapidly and effectively deal with variations in plant characteristics, compensate for wear and tear, and handle disturbances and noise.<<ETX>>",1066-033X;1066033X,,10.1109/37.387620,,https://ieeexplore.ieee.org/stamp/stamp.jsp?arnumber=387620,,Control systems;Delay;Error correction;Fault tolerance;Fuzzy control;Hardware;Real time systems;Robustness;Shape control;Table lookup,control system synthesis;fuzzy control;learning systems;microcontrollers;robust control,Intel-8031-based hardware;basic control concepts;extensibility;fault tolerance;learning fuzzy controller;limited plant-dependent information;robustness;system-independent learning rules;vacuous initial control policy,,11,,24,,,,June 1995,,IEEE,IEEE Journals & Magazines
Reinforcement learning for game personalization on edge devices,A. Bodas; B. Upadhyay; C. Nadiger; S. Abdelhak,Intel Corporation,2018 International Conference on Information and Computer Technologies (ICICT),20180510,2018,,,119,122,"Good progress has been shown recently in the area of active learning, specifically, Reinforcement learning (RL). In this paper, the authors show how RL can be used to personalize games based on user-interaction with the game. The work uses Deep Q network models (DQN) and the open source framework OpenAI to build an RL model that is able to optimize the gamer's engagement level in a game. The authors define an example quantitative measure of gamer engagement and incorporate that into the DQN learning reward function. The gamer experience optimization is empirically demonstrated using a game of Pong. Simulation testing and analysis of results indicate adapted RL models increase engagement reward values, thus enhancing gamer experience. The contribution of this paper is twofold: (1) using RL, it paves the path for wider adaptation to user-behavior, starting with gaming, and (2) it shows analysis and feasibility of an RL algorithm on an edge device (Personal Computer) in real-time.",,Electronic:978-1-5386-5384-5; POD:978-1-5386-5385-2; Paper:978-1-5386-5382-1; USB:978-1-5386-5383-8,10.1109/INFOCT.2018.8356853,,https://ieeexplore.ieee.org/stamp/stamp.jsp?arnumber=8356853,artificial intelligence;computer games;edge computing;game personalization;reinforcement learning,Adaptation models;Buildings;Games;Learning (artificial intelligence);Mathematical model;Training,computer games;learning (artificial intelligence);mobile computing,DQN learning reward function;RL algorithm;RL model;active learning;deep Q network models;edge device;engagement reward values;game personalization;gamer engagement;gamer experience;open source framework OpenAI;personal computer;reinforcement learning,,,,,,,,23-25 March 2018,,IEEE,IEEE Conferences
Learning to dribble on a real robot by success and failure,M. Riedmiller; R. Hafner; S. Lange; M. Lauer,"Dept. of Mathematics and Informatics, Institute of Computer Science and Institute of Cognitive Science, University of Osnabr&#252;ck, Germany",2008 IEEE International Conference on Robotics and Automation,20080613,2008,,,2207,2208,"Learning directly on real world systems such as autonomous robots is a challenging task, especially if the training signal is given only in terms of success or failure (reinforcement learning). However, if successful, the controller has the advantage of being tailored exactly to the system it eventually has to control. Here we describe, how a neural network based RL controller learns the challenging task of ball dribbling directly on our middle-size robot. The learned behaviour was actively used throughout the RoboCup world championship tournament 2007 in Atlanta, where we won the first place. This constitutes another important step within our Brainstormers project. The goal of this project is to develop an intelligent control architecture for a soccer playing robot, that is able to learn more and more complex behaviours from scratch.",1050-4729;10504729,POD:978-1-4244-1646-2,10.1109/ROBOT.2008.4543536,,https://ieeexplore.ieee.org/stamp/stamp.jsp?arnumber=4543536,,Biological neural networks;Cognitive robotics;Control systems;Informatics;Intelligent robots;Learning;Mathematics;Robotics and automation;System testing;USA Councils,control engineering computing;learning (artificial intelligence);learning systems;mobile robots;multi-robot systems;neurocontrollers,Brainstormers project;RoboCup;intelligent control;middle-size robot;neural network;reinforcement learning;robot learning;soccer playing robot,,2,,7,,,,19-23 May 2008,,IEEE,IEEE Conferences
A Neural Network Model of Multisensory Representation of Peripersonal Space: Effect of tool use,M. Ursino; M. Zavaglia; E. Magosso; A. Serino; G. di Pellegrino,"Department of Electronics, Computer Science and Systems, University of Bologna, Bologna, Italy",2007 29th Annual International Conference of the IEEE Engineering in Medicine and Biology Society,20071022,2007,,,2735,2739,"This work describes an original neural network to simulate representation of the peripersonal space around one hand, in basal conditions and after training with a tool used to reach the far space. The model is composed of two unimodal areas (visual and tactile) connected to a third bimodal area (visual-tactile). Neurons in the bimodal area integrate visual and tactile information and are activated only when a stimulus falls inside the peripersonal space. Moreover, the model assumes that synapses linking unimodal to bimodal neurons can be reinforced by an Hebbian rule during training, but this reinforcement is also under the influence of attention mechanisms. Results show that the peripersonal space, which includes just a small visual space around the hand in normal conditions, becomes elongated in the direction of the tool after training. This expansion of the peripersonal space depends on an expansion of the visual receptive field of bimodal neurons, due to a reinforcement of visual synapses, which were just latent before training. The model may be of value to analyze the neural mechanisms responsible for representing and plastically shaping peripersonal space, and in perspective, for interpretation of psychophysical data on patients with brain damage.",1094-687X;1094687X,CD-ROM:978-1-4244-0788-0; POD:978-1-4244-0787-3,10.1109/IEMBS.2007.4352894,,https://ieeexplore.ieee.org/stamp/stamp.jsp?arnumber=4352894,,Animals;Biological neural networks;Computer science;Computer simulation;Humans;Neural networks;Neurons;Plastics;Psychology;Radio frequency,Hebbian learning;biology computing;neural nets;neurophysiology;touch (physiological);vision,Hebbian rule;attention mechanism;bimodal neurons;bimodal visual-tactile perception;hand peripersonal space;neural network model;peripersonal space multisensory representation;peripersonal space plastic shaping;synapses;unimodal neurons;unimodal tactile perception;unimodal visual perception;visual receptive field expansion;visual synapse reinforcement,"Animals;Hand;Haplorhini;Humans;Neural Networks (Computer);Neurons, Afferent;Personal Space;Physical Stimulation;Synapses;Tool Use Behavior;Touch;Visual Perception",2,,19,,,,22-26 Aug. 2007,,IEEE,IEEE Conferences
Distributed Q-learning based dynamic spectrum access in high capacity density cognitive cellular systems using secondary LTE spectrum sharing,N. Morozs; D. Grace; T. Clarke,"Department of Electronics, University of York, Heslington, YO10 5DD, United Kingdom",2014 International Symposium on Wireless Personal Multimedia Communications (WPMC),20150122,2014,,,462,467,"In this paper a distributed Q-learning based dynamic spectrum access (DSA) algorithm is applied to a cognitive cellular system designed for providing ultra high capacity density with only secondary access to an LTE channel. Large scale simulations of a stadium temporary event scenario show that the distributed Q-learning based DSA scheme provides robust quality of service (QoS) and extremely high system throughput densities to the users of the stadium network, whilst successfully coexisting with a primary network of macro eNodeBs on the same LTE channel. It is also shown that incorporating spectrum awareness or spectrum sensing based admission control into the DSA algorithm in this scenario does not improve its performance. Therefore, distributed Q-learning based DSA is a viable and easily implementable solution for facilitating secondary LTE spectrum sharing in high capacity density cognitive cellular systems.",1347-6890;13476890,Electronic:978-9860-3-3407-4,10.1109/WPMC.2014.7014863,,https://ieeexplore.ieee.org/stamp/stamp.jsp?arnumber=7014863,Cognitive Cellular Systems;Dynamic Spectrum Access;Reinforcement Learning;Small Cells;Spectrum Sharing,Cognitive radio;Data models;Interference;Quality of service;Sensors;Throughput,Long Term Evolution;cellular radio;channel allocation;cognitive radio;learning (artificial intelligence);quality of service;radio spectrum management;signal detection;telecommunication computing;telecommunication congestion control,LTE channel secondary access;admission control;distributed Q-learning;dynamic spectrum access;high capacity density cognitive cellular systems;macro eNodeBs;quality of service;secondary LTE spectrum sharing;spectrum awareness;spectrum sensing,,4,,23,,,,7-10 Sept. 2014,,IEEE,IEEE Conferences
Learning rate control for downlink shared channel in WCDMA,B. Makarevitch,,"14th IEEE Proceedings on Personal, Indoor and Mobile Radio Communications, 2003. PIMRC 2003.",20040114,2003,3,,2919,2922 vol.3,"The paper considers bit rate control algorithms for the downlink shared channel in WCDMA (wideband code division multiple access) network. The goal of the rate control is to maximise the data throughput while satisfying quality constraints for the voice users. A learning algorithm, based on Reinforcement learning, is proposed. The algorithm facilitates frame acknowledgments to make decisions on the rate change. The control channel power is used as the state variable and a probabilistic decision policy is applied. Performance of the algorithm is evaluated and compared with performance of a simple algorithm without learning. Data throughput and voice quality cost function are used as performance measures. The learning algorithm achieves higher throughput and lower voice quality cost than the reference algorithm.",,POD:0-7803-7822-9,10.1109/PIMRC.2003.1259284,,https://ieeexplore.ieee.org/stamp/stamp.jsp?arnumber=1259284,,Control systems;Cost function;Downlink;Intelligent networks;Interference;Learning;Multiaccess communication;Propagation losses;Throughput;Wideband,broadband networks;code division multiple access;learning (artificial intelligence);probability;telecommunication channels;telecommunication links,Reinforcement learning;WCDMA;bit rate control algorithm;downlink shared channel;learning algorithm;probabilistic decision policy;state variable;voice user;wideband code division multiple access,,1,,5,,,,7-10 Sept. 2003,,IEEE,IEEE Conferences
Design of semi-decentralized control laws for distributed-air-jet micromanipulators by reinforcement learning,L. Matignon; G. J. Laurent; N. Le Fort-Piat,"FEMTOST/UFC-ENSMM-UTBM-CNRS, Universit&#233; de Franche-Comt&#233;, Besan&#231;on, France",2009 IEEE/RSJ International Conference on Intelligent Robots and Systems,20091215,2009,,,3277,3283,"Recently, a great deal of interest has been developed in learning in multi-agent systems to achieve decentralized control. Machine learning is a popular approach to find controllers that are tailored exactly to the system without any prior model. In this paper, we propose a semi-decentralized reinforcement learning control approach in order to position and convey an object on a contact-free MEMS-based distributed-manipulation system. The experimental results validate the semi-decentralized reinforcement learning method as a way to design control laws for such distributed systems.",2153-0858;21530858,POD:978-1-4244-3803-7,10.1109/IROS.2009.5353902,,https://ieeexplore.ieee.org/stamp/stamp.jsp?arnumber=5353902,,Actuators;Control systems;Distributed control;Electrodes;Machine learning;Micromanipulators;Microvalves;Multiagent systems;Open loop systems;Sorting,distributed control;jets;learning (artificial intelligence);micromanipulators;micromechanical devices;multi-agent systems,MEMS based distributed manipulation system;distributed air jet micromanipulators;distributed systems;machine learning;multi agent systems;reinforcement learning;semi decentralized control laws;semi decentralized reinforcement learning control,,1,,21,,,,10-15 Oct. 2009,,IEEE,IEEE Conferences
Reinforcement Learning for Active Queue Management in Mobile All-IP Networks,N. Vucevic; J. Perez-Romero; O. Sallent; R. Agusti,"Dept. TSC, Universitat Polit&#232;cnica de Catalunya (UPC), Barcelona, Spain","2007 IEEE 18th International Symposium on Personal, Indoor and Mobile Radio Communications",20071204,2007,,,1,5,"In future all-IP based wireless networks, like the envisaged in the long term evolution (LTE) architectures for future systems, network providers will have to deal with large traffic volumes with different QoS requirements. In order to increase exploitation of network resources wisely, intelligent adaptive solutions for class based traffic regulation are needed. In particular, active queue management (AQM) is regarded as one of these solutions to provide low queuing delay and high throughput to flows by smart packet discarding. In this paper, we propose a novel AQM solution for future all-IP networks based on a reinforcement learning scheme that allows controlling both the queuing delay and the packet loss of the different service classes. The proposed approach is evaluated through simulations and compared against other algorithms used in the literature, like the random early detection (RED) and the drop from tail (DFT), confirming the benefits of the proposed algorithm.",2166-9570;21669570,CD-ROM:978-1-4244-1144-3; POD:978-1-4244-1143-6,10.1109/PIMRC.2007.4394713,,https://ieeexplore.ieee.org/stamp/stamp.jsp?arnumber=4394713,,Bandwidth;Delay;Diffserv networks;Intelligent networks;Learning;Mobile communication;Quality of service;Tail;Telecommunication traffic;Traffic control,IP networks;learning (artificial intelligence);mobile computing;mobility management (mobile radio);queueing theory;telecommunication traffic,AQM;QoS;active queue management;all-IP based wireless networks;class based traffic regulation;drop from tail;intelligent adaptive solutions;mobile all-IP networks;network resources exploitation;queuing delay;random early detection;reinforcement learning,,2,,15,,,,3-7 Sept. 2007,,IEEE,IEEE Conferences
Emergency Navigation in Confined Spaces Using Dynamic Grouping,H. Bi; O. J. Akinwande; E. Gelenbe,"Dept. of Electr. & Electron. Eng., Imperial Coll. London, London, UK","2015 9th International Conference on Next Generation Mobile Applications, Services and Technologies",20160107,2015,,,120,125,"The performance of Emergency Management Systems (EMS) in confined spaces is highly dependent on the decision algorithm employed for the safe navigation of the evacuees to the available exits. In the algorithm proposed in this paper, we have considered evacuees under two groups, based on their age and physical condition, and we tailor two routing metrics, one for each group, in finding suitable paths for the evacuees. A dynamic grouping mechanism that can adjust an evacuee's group, and therefore routing metric, according to its on-going health condition is employed during the evacuation. To implement the routing metrics, we have used the Cognitive Packet Network (CPN) with random neural networks (RNN) and reinforcement learning. The CPN is an adaptive routing protocol that is loop-free at all times and easily handles multiple quality of service (QoS) metrics. Simulation results show that allowing the navigation system to be sensitive to the on-going health conditions and mobility of the evacuees, using our proposed dynamic grouping, can achieve higher survival rates.",,CD-ROM:978-1-4799-8659-0; Electronic:978-1-4799-8660-6; POD:978-1-4799-8661-3,10.1109/NGMAST.2015.12,,https://ieeexplore.ieee.org/stamp/stamp.jsp?arnumber=7373229,Cognitive Packet Network;Dynamic Grouping;Emergency navigation;QoS driven protocol,Buildings;Hazards;Heuristic algorithms;Measurement;Navigation;Quality of service;Routing,cognitive radio;emergency management;learning (artificial intelligence);navigation;neural nets;packet radio networks;quality of service;routing protocols;safety,CPN;EMS;QoS metrics;RNN;adaptive routing protocol;cognitive packet network;confined spaces;decision algorithm;dynamic grouping mechanism;emergency management systems;emergency navigation;health conditions;navigation safety;navigation system;physical condition;quality of service metrics;random neural networks;reinforcement learning;routing metrics,,,,22,,,,9-11 Sept. 2015,,IEEE,IEEE Conferences
MPRL: Multiple-Periodic Reinforcement Learning for difficulty adjustment in rehabilitation games,Y. A. Sekhavat,"Faculty of Multimedia, Tabriz Islamic Art University, Iran",2017 IEEE 5th International Conference on Serious Games and Applications for Health (SeGAH),20170608,2017,,,1,7,"Generally, the difficulty level of a therapeutic game is regulated manually by a therapist. However, home-based rehabilitation games require a technique for automatic difficulty adjustment. This paper proposes a personalized difficulty adjustment technique for a rehabilitation game that automatically regulates difficulty settings based on a patient's skills in real-time. To this end, ideas from reinforcement learning are used to dynamically adjust the difficulty of a game. We show that difficulty adjustment is a multiple-objective problem, in which some objectives might be evaluated at different periods. To address this problem, we propose and use Multiple-Periodic Reinforcement Learning (MPRL) that makes it possible to evaluate different objectives of difficulty adjustment in separate periods. The results of experiments show that MPRL outperforms traditional Multiple-Objective Reinforcement Learning (MORL) in terms of user satisfaction parameters as well as improving the movement skills of patients.",,Electronic:978-1-5090-5482-4; POD:978-1-5090-5483-1,10.1109/SeGAH.2017.7939260,,https://ieeexplore.ieee.org/stamp/stamp.jsp?arnumber=7939260,,Biological cells;Silicon,learning (artificial intelligence);medical computing;patient rehabilitation;serious games (computing),home-based rehabilitation games;multiple-objective problem;multiple-periodic reinforcement learning;patient movement skills;therapeutic game,,,,,,,,2-4 April 2017,,IEEE,IEEE Conferences
Personalized tuning of a reinforcement learning control algorithm for glucose regulation,E. Daskalaki; P. Diem; S. G. Mougiakakou,"Diabetes Technology Research Group, ARTORG Center for Biomedical Engineering Research, University of Bern, 3010, Switzerland",2013 35th Annual International Conference of the IEEE Engineering in Medicine and Biology Society (EMBC),20130926,2013,,,3487,3490,"Artificial pancreas is in the forefront of research towards the automatic insulin infusion for patients with type 1 diabetes. Due to the high inter- and intra-variability of the diabetic population, the need for personalized approaches has been raised. This study presents an adaptive, patient-specific control strategy for glucose regulation based on reinforcement learning and more specifically on the Actor-Critic (AC) learning approach. The control algorithm provides daily updates of the basal rate and insulin-to-carbohydrate (IC) ratio in order to optimize glucose regulation. A method for the automatic and personalized initialization of the control algorithm is designed based on the estimation of the transfer entropy (TE) between insulin and glucose signals. The algorithm has been evaluated in silico in adults, adolescents and children for 10 days. Three scenarios of initialization to i) zero values, ii) random values and iii) TE-based values have been comparatively assessed. The results have shown that when the TE-based initialization is used, the algorithm achieves faster learning with 98%, 90% and 73% in the A+B zones of the Control Variability Grid Analysis for adults, adolescents and children respectively after five days compared to 95%, 78%, 41% for random initialization and 93%, 88%, 41% for zero initial values. Furthermore, in the case of children, the daily Low Blood Glucose Index reduces much faster when the TE-based tuning is applied. The results imply that automatic and personalized tuning based on TE reduces the learning period and improves the overall performance of the AC algorithm.",1094-687X;1094687X,Electronic:978-1-4577-0216-7; POD:978-1-4577-0215-0; USB:978-1-4577-0214-3,10.1109/EMBC.2013.6610293,,https://ieeexplore.ieee.org/stamp/stamp.jsp?arnumber=6610293,,Algorithm design and analysis;Diabetes;Insulin;Integrated circuits;Learning (artificial intelligence);Sugar;Vectors,blood;entropy;learning (artificial intelligence);medical computing;paediatrics;sugar,Actor-Critic learning approach;TE-based initialization;adolescents;artificial pancreas;automatic insulin infusion;basal rate;control variability grid analysis;glucose regulation;glucose signals;insulin signals;insulin-to-carbohydrate ratio;low-blood glucose index;patient-specific control strategy;personalized tuning;reinforcement learning control algorithm;transfer entropy;type 1 diabetes,"Adolescent;Adult;Algorithms;Blood Glucose;Child;Humans;Insulin;Pancreas, Artificial;Precision Medicine;Signal Processing, Computer-Assisted",3,,27,,,,3-7 July 2013,,IEEE,IEEE Conferences
