Distributed energy cooperation for energy harvesting nodes using reinforcement learning,W. T. Lin; I. W. Lai; C. H. Lee,"Research Center for Information Technology Innovation, Academia Sinica, Taipei, Taiwan","2015 IEEE 26th Annual International Symposium on Personal, Indoor, and Mobile Radio Communications (PIMRC)",20151203,2015,,,1584,1588,"Wireless communication with nodes capable of harvesting energy emerges as a new technology challenge. In this paper, we investigate the problem of utilizing energy cooperation among energy-harvesting transmitters to maximize the data rate performance. We consider a general framework which can be applied to either cellular networks with base station energy cooperation through wired power grid or sensor networks with transmitting node energy cooperation through wireless power transfer. We model this energy cooperation problem as an infinite horizon Markov decision process (MDP), which can be optimally solved by the value iteration algorithm. Since the optimal value iteration algorithm has high complexity and requires non-causal information, we propose a distributed algorithm by using reinforcement learning and splitting the MDP into several small MDPs, each associated with a transmitter. Simulation results demonstrate the effectiveness of the proposed distributed energy cooperation algorithm.",,Electronic:978-1-4673-6782-0; POD:978-1-4673-6783-7,10.1109/PIMRC.2015.7343551,,https://ieeexplore.ieee.org/stamp/stamp.jsp?arnumber=7343551,,Batteries;Energy exchange;Power grids;Radio transmitters;Receivers;Wireless communication,Markov processes;cellular radio;computational complexity;energy harvesting;iterative methods;learning (artificial intelligence);power grids;radio transmitters;telecommunication computing;telecommunication power management,MDP;base station energy cooperation;cellular network;distributed energy cooperation;energy harvesting transmitter;infinite horizon Markov decision process;iteration algorithm;reinforcement learning;sensor network;wired power grid;wireless communication;wireless power transfer,,,,16,,,,Aug. 30 2015-Sept. 2 2015,,IEEE,IEEE Conferences
Improving management of Anemia in End Stage Renal Disease using Reinforcement Learning,A. E. Gaweda,"Department of Medicine, Division of Nephrology, University of Louisville, USA",2009 International Joint Conference on Neural Networks,20090731,2009,,,953,958,We present a reinforcement learning approach to elicit individualized dose adjustment policies for patients suffering anemia due to end stage renal disease. Our goal is to achieve stable steady-state anemia management in patients with exhibiting different levels of treatment response. The approach uses Q-learning with parsimonious parametric representation of the state-action value function. We show that this approach achieves stability even in highly responsive patients.,2161-4393;21614393,POD:978-1-4244-3548-7,10.1109/IJCNN.2009.5179004,,https://ieeexplore.ieee.org/stamp/stamp.jsp?arnumber=5179004,,Automatic control;Cardiac disease;Conference management;Function approximation;Humans;Learning;Medical treatment;Neural networks;Protocols;Steady-state,diseases;kidney;learning (artificial intelligence);medical computing;patient treatment,Q-learning;end stage renal disease;individualized dose adjustment policy;parsimonious parametric representation;patient treatment;reinforcement learning;stable steady-state anemia management;state-action value function,,1,,14,,,,14-19 June 2009,,IEEE,IEEE Conferences
Model Learning and Knowledge Sharing for a Multiagent System With Dyna-Q Learning,K. S. Hwang; W. C. Jiang; Y. J. Chen,"Department of Electrical Engineering, National Sun Yat-sen University, Kaohsiung, Taiwan",IEEE Transactions on Cybernetics,20150413,2015,45,5,978,990,"In a multiagent system, if agents' experiences could be accessible and assessed between peers for environmental modeling, they can alleviate the burden of exploration for unvisited states or unseen situations so as to accelerate the learning process. Since how to build up an effective and accurate model within a limited time is an important issue, especially for complex environments, this paper introduces a model-based reinforcement learning method based on a tree structure to achieve efficient modeling and less memory consumption. The proposed algorithm tailored a Dyna-Q architecture to multiagent systems by means of a tree structure for modeling. The tree-model built from real experiences is used to generate virtual experiences such that the elapsed time in learning could be reduced. As well, this model is suitable for knowledge sharing. This paper is inspired by the concept of knowledge sharing methods in multiagent systems where an agent could construct a global model from scattered local models held by individual agents. Consequently, it can increase modeling accuracy so as to provide valid simulated experiences for indirect learning at the early stage of learning. To simplify the sharing process, the proposed method applies resampling techniques to grafting partial branches of trees containing required and useful experiences disseminated from experienced peers, instead of merging the whole trees. The simulation results demonstrate that the proposed sharing method can achieve the objectives of sample efficiency and learning acceleration in multiagent cooperation applications.",2168-2267;21682267,,10.1109/TCYB.2014.2341582,,https://ieeexplore.ieee.org/stamp/stamp.jsp?arnumber=6871355,Decision tree;Dyna-Q;model sharing;multiagent system,Decision trees;Mathematical model;Multi-agent systems;Planning;Stochastic processes;Support vector machine classification;Vectors,,,,3,,20,,,20140805,May 2015,,IEEE,IEEE Journals & Magazines
Neural networks for incremental dimensionality reduced reinforcement learning,W. Curran; R. Pocius; W. D. Smart,"Oregon State University, Corvallis, United States",2017 IEEE/RSJ International Conference on Intelligent Robots and Systems (IROS),20171214,2017,,,1559,1565,"State-of-the-art personal robots must perform complex manipulation tasks to be viable in assistive scenarios. However, many of these robots, like the PR2, use manipulators with high degrees-of-freedom. The complexity of these robots lead to large dimensional state spaces, which are difficult to fully explore. Our previous work introduced the IDRRL algorithm, which compresses the learning space by transforming a high-dimensional learning space onto a lower-dimensional manifold while preserving expressivity. In this work we formally prove that IDRRL maintains PAC-MDP guarantees. We then improve upon our previous formulation of IDRRL by introducing cascading autoencoders (CAE) for dimensionality reduction, producing the new algorithm IDRRL-CAE. We demonstrate the improvement of this extension over our previous formulation, IDRRL-PCA, in the Mountain Car and Swimmers domains.",,Electronic:978-1-5386-2682-5; POD:978-1-5386-2683-2; USB:978-1-5386-2681-8,10.1109/IROS.2017.8205962,,https://ieeexplore.ieee.org/stamp/stamp.jsp?arnumber=8205962,,Algorithm design and analysis;Computational complexity;Learning (artificial intelligence);Principal component analysis;Robots,learning (artificial intelligence);manipulators;neurocontrollers;principal component analysis,IDRRL algorithm;IDRRL-CAE;IDRRL-PCA;PAC-MDP;PR2;cascading autoencoders;dimensionality reduction;high-dimensional learning space;incremental dimensionality;lower-dimensional manifold;manipulation tasks;manipulators;neural networks;personal robots;reinforcement learning,,,,,,,,24-28 Sept. 2017,,IEEE,IEEE Conferences
<formula><tex>$mathsf{Hap-SliceR}$</tex></formula>: A Radio Resource Slicing Framework for 5G Networks With Haptic Communications,A. Aijaz,"Telecommunications Research Laboratory, Toshiba Research Europe, Ltd., Bristol, BS1 4ND, U.K.&#x00A0;(e-mail: adnan.aijaz@toshiba-trel.com).",IEEE Systems Journal,,2017,Early Access,Early Access,1,12,"It is expected that the emerging 5G networks will not only support diverse use cases, but also enable unprecedented applications such as haptic communications. Therefore, network slicing will provide the required design flexibility. Radio resource slicing would be an indispensable component of any network slicing solution. This paper proposes <formula><tex>$mathsf{Hap-SliceR}$</tex></formula>, which is a novel radio resource slicing framework for 5G networks with haptic communications. First, <formula><tex>$mathsf{Hap-SliceR}$</tex></formula> derives a network-wide radio resource slicing strategy for 5G networks. The optimal slicing strategy, which is based on a reinforcement learning approach, allocates radio resources to different slices while accounting for the dynamics and utility requirements of different slices. Second, <formula><tex>$mathsf{Hap-SliceR}$</tex></formula> provides customization of radio resources for haptic communications over 5G networks. The radio resource allocation requirements of haptic communications have been translated into a unique radio resource allocation problem. A low-complexity heuristic algorithm has been developed for resource allocation. Finally, a comprehensive performance evaluation of <formula><tex>$mathsf{Hap-SliceR}$</tex></formula> has been conducted based on a recently proposed 5G air-interface design.",1932-8184;19328184,,10.1109/JSYST.2017.2647970,,https://ieeexplore.ieee.org/stamp/stamp.jsp?arnumber=7831356,5G;LTE-A;haptic communications;radio resource allocation;radio resource slicing;virtualization,5G mobile communication;Base stations;Dynamic scheduling;Haptic interfaces;Resource virtualization;Wireless communication,,,,,,,,,20170124,,,IEEE,IEEE Early Access Articles
Contextual multi-armed bandit algorithms for personalized learning action selection,I. Manickam; A. S. Lan; R. G. Baraniuk,"Rice University, United States of America","2017 IEEE International Conference on Acoustics, Speech and Signal Processing (ICASSP)",20170619,2017,,,6344,6348,"Optimizing the selection of learning resources and practice questions to address each individual student's needs has the potential to improve students' learning efficiency. In this paper, we study the problem of selecting a personalized learning action for each student (e.g. watching a lecture video, working on a practice question, etc.), based on their prior performance, in order to maximize their learning outcome. We formulate this problem using the contextual multi-armed bandits framework, where students' prior concept knowledge states (estimated from their responses to questions in previous assessments) correspond to contexts, the personalized learning actions correspond to arms, and their performance on future assessments correspond to rewards. We propose three new Bayesian policies to select personalized learning actions for students that each exhibits advantages over prior work, and experimentally validate them using real-world datasets.",,Electronic:978-1-5090-4117-6; POD:978-1-5090-4118-3; USB:978-1-5090-4116-9,10.1109/ICASSP.2017.7953377,,https://ieeexplore.ieee.org/stamp/stamp.jsp?arnumber=7953377,contextual bandits;personalized learning,Approximation algorithms;Bayes methods;Context;Programmable logic arrays;Random variables;Schedules;Uncertainty,educational institutions,Bayesian policies;contextual multi-armed bandit algorithms;learning resources;personalized learning action selection;prior concept knowledge states;student learning efficiency,,,,,,,,5-9 March 2017,,IEEE,IEEE Conferences
User modeling with limited data: Application to stakeholder-driven watershed design,S. Mukhopadhyay; V. B. Singh; M. Babbar-Sebens,"Computer & Information Science, Indiana University Purdue University Indianapolis, USA","2014 IEEE International Conference on Systems, Man, and Cybernetics (SMC)",20141204,2014,,,3855,3860,"We have developed a web-based, interactive, watershed planning system called WRESTORE (Watershed Restoration Using Spatio-Temporal Optimization of Resources) (http://wrestore.iupui.edu) that allows stake-holder communities to participate in a democratic, collaborative form of optimization process for designing best management practices (BMPs) on their landscape, while also optimizing based on subjective, qualitative landowners' criteria beyond the usual socio-economic, physical, and ecological criteria. This system utilizes multiple advanced computational approaches including the SWAT (Soil and Water Assessment Tool) hydrologic model for watershed simulations, interactive genetic algorithms and reinforcement-based machine learning algorithms for search and optimization, and deep learning artificial neural networks for user modeling, within an encompassing human-computer interaction framework. A substantial user study of the WRESTORE system was conducted recently involving multiple real stakeholders varying from consultants, government officials, watershed alliance members, etc., with the objective of gaining insight about WRESTORE'S usability and utility. In particular focus was the user modeling component that develops a computational model of a user's preferences and criteria, based on real-time user-provided ratings for a subset of possible designs (similar to the idea of user profiling commonly done for human-computer interaction systems). The user model constructed based on the real user's personalized feedbacks can then be used to influence the automated search and optimization for BMP alternatives in WRESTORE. In this paper, we describe the methods developed for user modeling for interactive optimization, and the experimental set-up as well as results with real user studies. These results clearly demonstrate that development of user models for such personalized, interactive optimization is both feasible and valuable for developing community-based computa- ional water sustainability solutions.",1062-922X;1062922X,Electronic:978-1-4799-3840-7; POD:978-1-4799-3841-4; USB:978-1-4799-3839-1,10.1109/SMC.2014.6974532,,https://ieeexplore.ieee.org/stamp/stamp.jsp?arnumber=6974532,decision support system;interactive optimization;machine learning;sustainability design;user modeling,Adaptation models;Artificial neural networks;Computational modeling;Data models;Mathematical model;Optimization,Internet;environmental science computing;human computer interaction;hydrology;interactive systems;learning (artificial intelligence);neural nets;socio-economic effects;water resources,BMP;SWAT hydrologic model;WRESTORE;Web-based interactive watershed planning system;best management practices;community-based computational water sustainability solutions;deep learning artificial neural networks;ecological criteria;human-computer interaction framework;interactive genetic algorithms;limited data;physical criteria;reinforcement-based machine learning algorithms;socio-economic criteria;soil and water assessment tool;stakeholder-driven watershed design;user modeling;watershed restoration using spatio-temporal optimization of resources,,0,,21,,,,5-8 Oct. 2014,,IEEE,IEEE Conferences
Learning motor skills with non-rigid materials by reinforcement learning,D. Shinohara; T. Matsubara; M. Kidode,"Graduate School of Information Science, Nara Institute of Science and Technology, Japan",2011 IEEE International Conference on Robotics and Biomimetics,20120412,2011,,,2676,2681,"This paper focuses on learning motor skills for anthropomorphic robots which must interact with non-rigid materials to perform tasks, such as wearing clothes, turning socks inside out, and bandaging. To learn such a motor skill, the task to be performed needs to be quantitatively defined using not only the state of the robot, but also the state of the non-rigid material. However, the non-rigid material is generally represented in a high dimensional configuration space (e.g., [1]) and obtaining such information in a real environment is difficult. In this paper we propose a novel learning framework for learning motor skills interacting with non-rigid materials by reinforcement learning that avoids these difficulties. Our learning framework focuses on the topological relationship between the configuration of the robot and the non-rigid material based on the consideration that most details of the material (e.g., wrinkles) are not important for performing the motor tasks. This focus allows us to define the task performance and provide reward signals based on a low-dimensional variable and to measure task performance in a real environment using reliable sensors. We constructed an experimental setting with an anthropomorphic dual-arm robot and a tailor-made T-shirt for the robot. To demonstrate the feasibility of the proposed method, we applied the method to have the robot perform the motor task of putting on the T-shirt. As a result of our learning framework, through trial and error the robot was able to acquire sequential movements that performed the goal of putting both arms into the corresponding sleeves of the T-shirt.",,DVD:978-1-4577-2137-3; Electronic:978-1-4577-2138-0; POD:978-1-4577-2136-6,10.1109/ROBIO.2011.6181709,,https://ieeexplore.ieee.org/stamp/stamp.jsp?arnumber=6181709,,Joints;Manipulators;Materials;Robot kinematics;Topology;Trajectory,humanoid robots;learning (artificial intelligence);motion control,anthropomorphic robot;dual-arm robot;high dimensional configuration space;low-dimensional variable;motor skill;nonrigid material;reinforcement learning;sequential movement;tailor-made T-shirt;topological relationship,,2,,18,,,,7-11 Dec. 2011,,IEEE,IEEE Conferences
Genetic reinforcement learning for scheduling heterogeneous machines,G. H. Kim; C. S. G. Lee,"Sch. of Electr. & Comput. Eng., Purdue Univ., West Lafayette, IN, USA",Proceedings of IEEE International Conference on Robotics and Automation,20020806,1996,3,,2798,2803 vol.3,"Concerns the development of a learning-based heuristic for scheduling heterogeneous machines. List scheduling methods are flexible enough to be used for a large class of problems, including the heterogeneous machine problem. However, designing a priority rule requires insight into the characteristics of the problem. We propose the iterative list scheduling, which refines priority rules while generating a number of schedules. We also show that the iterative list scheduling can be formulated as a reinforcement learning problem, defining states and actions. Due to the large number of possible states, reinforcement learning algorithms which use value functions in constructing an optimal policy may not be suitable for scheduling problems. Encoding the policies of reinforcement learning into genetic algorithms leads to the genetic reinforcement learning (GRL), which directly works with the policies rather than the values of states. A GRL-based scheduler, EVIS (Evolutionary Intracell Scheduler), has been applied to problems such as the heterogeneous machine scheduling, the job-shop scheduling, the flow-shop scheduling, and the open-shop scheduling problems. The proposed model of EVIS, which has the linear order of population-fitness convergence, was verified with computer experiments. Even without fine tuning of EVIS, the quality of solutions found by EVIS was comparable to that of problem-tailored heuristics for most of the problem instances",1050-4729;10504729,POD:0-7803-2988-0,10.1109/ROBOT.1996.506586,,https://ieeexplore.ieee.org/stamp/stamp.jsp?arnumber=506586,,Biological cells;Encoding;Genetic algorithms;Genetic engineering;Iterative algorithms;Job shop scheduling;Learning;Processor scheduling;Scheduling algorithm;Space exploration,genetic algorithms;heuristic programming;iterative methods;learning (artificial intelligence);production control,EVIS;Evolutionary Intracell Scheduler;genetic reinforcement learning;heterogeneous machine scheduling;iterative list scheduling;learning-based heuristic;linear-order population-fitness convergence;optimal policy;reinforcement learning problem,,3,,16,,,,22-28 Apr 1996,22 Apr 1996-28 Apr 1996,IEEE,IEEE Conferences
Learning capabilities for improving automatic transmission control,L. Fournier,"Dept. of Comput. Sci., Stanford Univ., CA, USA","Intelligent Vehicles '94 Symposium, Proceedings of the",20020806,1994,,,455,460,"We analyzed the gear-box position selection (GPS) problem on automatic transmission (AT) and proposed an algorithm, based on learning control, to improve vehicle behavior and driver satisfaction. Our approach guarantees optimization of vehicle performance and adaptation to the driver's style with road condition sensitivity. This improvement has been achieved by combining three knowledge acquisition sources: embedded dynamic models of powertrain, inductive inspection of driver actions and AT designer expertise; and by adding learning capabilities in order to significantly increase the system autonomy. Technically, GPS raises the following four problems which this paper addresses: (1) To achieve vehicle performance optimization of multiple antagonistic criteria, locally and globally over time, we considered a parametric disciminant function depending on an evaluation of the driver satisfaction and so called driver-style-state functions, as a reward for the system, and applied a reinforcement learning algorithm, derived from Q-learning method and combined with a mechanism to escape local optima. (2) Learning directly from the driver is performed when he selects AT ratio in manual mode. (3) Each driver's personal style is represented by a Glass creation/selection mechanism. (4) GPS raises a few singularities which are addressed by a set of restriction rules derived from AT control expertise.",,POD:0-7803-2135-9,10.1109/IVS.1994.639561,,https://ieeexplore.ieee.org/stamp/stamp.jsp?arnumber=639561,,Algorithm design and analysis;Automatic control;Global Positioning System;Inspection;Knowledge acquisition;Mechanical power transmission;Power system modeling;Road vehicles;Vehicle driving;Vehicle dynamics,intelligent control;learning (artificial intelligence);learning systems;road vehicles,Glass creation/selection mechanism;Q-learning method;automatic transmission control;driver satisfaction;driver-style-state functions;embedded dynamic models;gear-box position selection;inductive inspection;knowledge acquisition;learning control;multiple antagonistic criteria;parametric disciminant function;performance optimization;powertrain;reinforcement learning algorithm;road condition sensitivity;singularities;vehicle behavior,,1,1,5,,,,24-26 Oct. 1994,,IEEE,IEEE Conferences
Computer-aided process control laboratory systems,K. M. Yusof; T. K. Liong; A. K. Baderon,"Dept. of Chem. Eng., Univ. Teknologi Malaysia, Malaysia",Proceedings IEEE 1st International Conference on Multi Media Engineering Education,20020806,1994,,,276,280,"This paper presents the use of personal computers in the process control laboratory at the Department of Chemical Engineering, Universiti Teknologi Malaysia. A description of four control systems interfaced to computers-a flow control system, a level control system, a heated tank control system and a fermenter/batch reactor control system are given. Being versatile controllers and data loggers, the computers also provide a friendly and appealing environment for students to perform experiments on the systems. The different characteristic of each system provides a variety of hands-on experience which incorporates the application of process control and reinforcement of the theories learnt in class. Finally, a sample experiment is included to illustrate the application and experience gained by students",,POD:0-7803-1963-X,10.1109/MMEE.1994.383204,,https://ieeexplore.ieee.org/stamp/stamp.jsp?arnumber=383204,,Application software;Chemical engineering;Computer interfaces;Control systems;Inductors;Laboratories;Level control;Microcomputers;Process control;Temperature control,computer aided instruction;control engineering computing;control engineering education;flow control;level control;process control,computer-aided process control laboratory systems;data loggers;fermenter/batch reactor control system;flow control system;heated tank control system;level control system;versatile controllers,,0,,,,,,6-8 Jul 1994,06 Jul 1994-08 Jul 1994,IEEE,IEEE Conferences
